{"$schema":"https://json-schema.org/draft/2020-12/schema","$id":"discovery-category.schema.json","type":"object","required":["source","source_role","source_category_key","name_raw","name_visible","url","breadcrumb","evidence_reference","rule_version"],"properties":{"source":{"enum":["ep","gam"]},"source_role":{"enum":["authoritative_existence","supplemental"]},"source_category_key":{"type":"string"},"name_raw":{"type":"string"},"name_visible":{"type":"string"},"url":{"type":"string"},"parent":{"type":["string","null"]},"breadcrumb":{"type":"array","items":{"type":"string"}},"evidence_reference":{"type":"string"},"rule_version":{"type":"string"}},"additionalProperties":false}
