{"source":"ep","source_role":"authoritative_existence","source_category_key":"url-key","name_raw":"Carretillas","name_visible":"Carretillas","url":"https://ep-equipment.com/es/productos/carretillas/","parent":null,"breadcrumb":[],"evidence_reference":"snapshots/run/ep/hash.html","rule_version":"ep-discovery-v1"}
